title,year,episodes,description,rating,link,image,genres,seasons
Lord of Vermilion: The Crimson King,2018,24,"After a high-frequency resonance echoes throughout Tokyo, various young people start developing blood-based supernatural powers.",76,https://www.wakanim.tv/sc/v2/catalogue/show/971/lord-of-vermilion-the-crimson-king,"https://d2y6mqrpjbqoe6.cloudfront.net/image/upload/f_auto,q_auto/cdn1/library/55_637242677745974704Lord-of-Vermilion_Small.jpg",Action | Adventure | Fantasy,2
Love Live! Nijigasaki High School Idol Club,2020,26,Nijigasaki High School is known for their diverse subjects and the freedom they give to students.,90,https://www.wakanim.tv/sc/v2/catalogue/show/1145/love-live-nijigasaki-high-school-idol-club,"https://d2y6mqrpjbqoe6.cloudfront.net/image/upload/f_auto,q_auto/cdn1/library/2210_637389812658617321NHSIC_Small.jpg",Music | Slice of Life,2
Love Live! Superstar!!,2021,24,"Tokyo’s brand-new Yuigaoka Girls’ High School has no history, no upperclassmen, and no reputation—its first students are starting from scratch! A team of five girls led by Kanon Shibuya discover school idols, and their hopes to do something with singing begin to grow. They begin the “School Idol Project” with a blank slate and infinite potential. It’s time for their Love Live to take flight!",90,https://www.wakanim.tv/sc/v2/catalogue/show/1442/love-live-superstar,"https://d2y6mqrpjbqoe6.cloudfront.net/image/upload/f_auto,q_auto/cdn1/library/306_637606658973191403LLS_Small.jpg",Music | Slice of Life,2
Lucky☆Star,2007,48,"When Konata Izumi isn’t reading manga or playing video games, she’s debating the mysteries of the universe
with her best friends.",78,https://www.wakanim.tv/sc/v2/catalogue/show/723/luckystar,"https://d2y6mqrpjbqoe6.cloudfront.net/image/upload/f_auto,q_auto/cdn1/library/263_637208357136685237Lucky-Star_Small.jpg",Comedy | Slice of Life,4
Lupin III: Part IV,2015,24,"Lupin the 3rd follows the thrilling adventures of master thief Arsène Lupin the 3rd, quite possibly the world's greatest thief. He's pulled off some of the most brilliant heists that no one ever thought possible.",92,https://www.wakanim.tv/sc/v2/catalogue/show/794/lupin-iii-part-iv,"https://d2y6mqrpjbqoe6.cloudfront.net/image/upload/f_auto,q_auto/cdn1/library/275_637577013101763969Lupin-Part4_Small.jpg",Action | Adventure | Comedy,2
Maesetsu! Opening Act,2020,12,These girls want nothing more than to work in the entertainment industry as professional comedians.,76,https://www.wakanim.tv/sc/v2/catalogue/show/1073/maesetsu-opening-act,"https://d2y6mqrpjbqoe6.cloudfront.net/image/upload/f_auto,q_auto/cdn1/library/210_637372591063058122maesetsu_small.jpg",Comedy | Music | Slice of Life,1
MAGATSU WAHRHEIT,2020,24,"Two young people living in the Varheit Empire, whose plans for relocating are proceeding: a little timid Inumael who works hard as a transporter, and Leocadio, a naive newcomer to the Empire.",82,https://www.wakanim.tv/sc/v2/catalogue/show/1093/magatsu-wahrheit,"https://d2y6mqrpjbqoe6.cloudfront.net/image/upload/f_auto,q_auto/cdn1/library/210_637372258752991970Magatsu_Small.jpg",Action | Fantasy | Magic,2
Magia Record: Puella Magi Madoka Magica Side Story,2020,38,"In exchange for the fulfillment of a wish, Magical Girls keep fighting, unbeknownst to the rest of the world.
But Iroha Tamaki can't seem to remember her wish.",76,https://www.wakanim.tv/sc/v2/catalogue/show/598/magia-record-puella-magi-madoka-magica-side-story,"https://d2y6mqrpjbqoe6.cloudfront.net/image/upload/f_auto,q_auto/cdn1/library/71_637140088660982419MR_Small.jpg",Drama | Thriller,4
Magia Record: Puella Magi Madoka Magica Side Story Final season,2022,0,The magical girls reach the endgame in Magia Record: Puella Magi Madoka Magica Side Story Final Season.,76,https://www.wakanim.tv/sc/v2/catalogue/show/1739/magia-record-puella-magi-madoka-magica-side-story-final-season,"https://d2y6mqrpjbqoe6.cloudfront.net/image/upload/f_auto,q_auto/cdn1/library/293_637841393388112625Magia-Record-Final-Season_Small.jpg",Drama | Thriller,0
Magia Record: Puella Magi Madoka Magica Side Story Season 2 -The Eve of Awakening-,2021,0,Iroha Tamaki is still searching for her memories... What was the wish that drove her to become a Puella Magi?,76,https://www.wakanim.tv/sc/v2/catalogue/show/1460/magia-record-puella-magi-madoka-magica-side-story-season-2-the-eve-of-awakening,"https://d2y6mqrpjbqoe6.cloudfront.net/image/upload/f_auto,q_auto/cdn1/library/287_637630808116461325Magia-2_Small.jpg",Drama | Thriller,0
Maken-Ki! Battling Venus 2,2014,20,"When Takeru enrolled in Tenbi Academy, he had dreams of being smothered by cute girls—not getting beat down by bouncy brawlers.",96,https://www.wakanim.tv/sc/v2/catalogue/show/705/maken-ki-battling-venus-2,"https://d2y6mqrpjbqoe6.cloudfront.net/image/upload/f_auto,q_auto/cdn1/library/273_637209005491813060Maken-Ki_Small.jpg",Action | Comedy | Ecchi | Magic | Martial Arts | Romance,2
MARS RED,2021,26,"It’s 1923, and until recently, vampires kept to the shadows. When the mysterious blood source Ascra appears, their numbers swell, leaving Japan covered in bodies. In response, the government spawns its own coven to infiltrate the dark.",70,https://www.wakanim.tv/sc/v2/catalogue/show/787/mars-red,"https://d2y6mqrpjbqoe6.cloudfront.net/image/upload/f_auto,q_auto/cdn1/library/24_637529557432383121MR_Small-2.jpg",Action | Fantasy | Sci-Fi | Vampire,2
Master of Martial Hearts,2008,10,"After Aya enters a girl-on-girl fighting tournament, she'll face beautiful babes in a series of fabric-shredding brawls.",66,https://www.wakanim.tv/sc/v2/catalogue/show/1032/master-of-martial-hearts,"https://d2y6mqrpjbqoe6.cloudfront.net/image/upload/f_auto,q_auto/cdn1/library/266_637287620544188123MMH_Small.jpg",Action | Ecchi | Martial Arts,2
MEGALOBOX 2: NOMAD,2021,26,"Bored, resigned, and unfulfilled, a young man with neither name nor past survives by fighting in underground matches of a sport called MEGALOBOX, a form of boxing that utilizes powered exoskeletons. Calling himself JNK.DOG, he feels trapped in a world of crime, poverty, and ecological collapse.",92,https://www.wakanim.tv/sc/v2/catalogue/show/1261/megalobox-2-nomad,"https://d2y6mqrpjbqoe6.cloudfront.net/image/upload/f_auto,q_auto/cdn1/library/24_637529533581582578NM2_Small.jpg",Action | Drama | Sci-Fi | Sport,2
Mieruko-chan,2021,24,"One day, Miko discovers that there are many spirits in this world that she seems to be the only one to see. Her first instinct? She builds up some courage and does the impossible: ignore them. Somewhere between horror and comedy, discover Miko's terrifying yet endearing daily life!",82,https://www.wakanim.tv/sc/v2/catalogue/show/1403/mieruko-chan,"https://d2y6mqrpjbqoe6.cloudfront.net/image/upload/f_auto,q_auto/cdn1/library/110_637687050119444160MC_Small.jpg",Comedy | Horror | Supernatural,1
Mikagura School Suite,2015,24,Formerly reclusive gamer Eruna Ichinomiya struggles to find her place at Mikagura High School. But her experience is far from ordinary…,84,https://www.wakanim.tv/sc/v2/catalogue/show/732/mikagura-school-suite,"https://d2y6mqrpjbqoe6.cloudfront.net/image/upload/f_auto,q_auto/cdn1/library/125_637248843618781613Mikagura-School_Small.jpg",Action | Comedy | Magic | Romance | Slice of Life | Supernatural,2
Mix,2019,48,Stepbrothers Touma and Suichirou are ace baseball players following in the tragic legacy of their fathers.,0,https://www.wakanim.tv/sc/v2/catalogue/show/924/mix,"https://d2y6mqrpjbqoe6.cloudfront.net/image/upload/f_auto,q_auto/cdn1/library/164_637226203153789757MIX_Small.jpg",Drama | Romance | Shounen | Sport,4
Mobile Suit Gundam Narrative,2018,1,"One year has passed since the contents of Laplace's Box were revealed to the world at the end of the conflict called the ""Laplace Incident."" Despite the revelation of the Universal Century Charter that acknowledges the existence and rights of Newtypes, the framework of the world has not been greatly altered.",0,https://www.wakanim.tv/sc/v2/catalogue/show/1641/mobile-suit-gundam-narrative,"https://d2y6mqrpjbqoe6.cloudfront.net/image/upload/f_auto,q_auto/cdn1/library/812_637745548675763278GN_Small.jpg",Action | Drama | Mecha | Sci-Fi,1
MOBILE SUIT GUNDAM WING,1995,49,The Revolution Has Begun!,0,https://www.wakanim.tv/sc/v2/catalogue/show/1593/mobile-suit-gundam-wing,"https://d2y6mqrpjbqoe6.cloudfront.net/image/upload/f_auto,q_auto/cdn1/library/2610_637708605697696371GW_Small.jpg",Action | Drama | Mecha | Sci-Fi,4
Mobile Suit Zeta Gundam,1985,50,"A mysterious mobile suit infiltrates the space colony known as Gryps, headquarters of the dreaded Titans. Its pilot is Char Aznable, the infamous Red Comet, who now fights for the rebel AEUG group under the alias Quattro Bajeena.",100,https://www.wakanim.tv/sc/v2/catalogue/show/1642/mobile-suit-zeta-gundam,"https://d2y6mqrpjbqoe6.cloudfront.net/image/upload/f_auto,q_auto/cdn1/library/812_637745556707693747ZG_Small.jpg",Action | Drama | Mecha,1
Moeyo Ken,2005,26,"Carrying on the work of their samurai fathers, Yuuko, Toshie, and Kaoru defend their people against outlawed and unlicensed beasts.",66,https://www.wakanim.tv/sc/v2/catalogue/show/686/moeyo-ken,"https://d2y6mqrpjbqoe6.cloudfront.net/image/upload/f_auto,q_auto/cdn1/library/183_637201450295781765Moeyo-Ken_Small.jpg",Action | Adventure | Comedy | Fantasy | Historical | Shounen | Supernatural,2
Monster Hunter Stories RIDE ON,2016,96,"A young boy journeys to find his own monster companion and awaken its powers, hoping to become the world’s greatest Rider.",0,https://www.wakanim.tv/sc/v2/catalogue/show/800/monster-hunter-stories-ride-on,"https://d2y6mqrpjbqoe6.cloudfront.net/image/upload/f_auto,q_auto/cdn1/library/36_637267728915292845Monster-Hunter-Stories_Small.jpg",Action | Adventure | Comedy | Fantasy,8
Moriarty the Patriot,2020,24,"William, a young, brillant and incredibly charismatic orphan, is taken in by the Moriarty's. Encouraged by Albert, the family's oldest son, he decides to clean society of its exploitation by the aristocracy, no matter the means employed to do so...",86,https://www.wakanim.tv/sc/v2/catalogue/show/1127/moriarty-the-patriot,"https://d2y6mqrpjbqoe6.cloudfront.net/image/upload/f_auto,q_auto/cdn1/library/110_637371624595432085Moriarty_Small.jpg",Drama | Historical | Shounen,2
Muhyo & Roji's Bureau of Supernatural Investigation,2020,24,"Do you know what's even trickier than the law? MAGIC LAW! The executioner duo is back this summer with the 2nd season of Muhyo & Roji's Bureau of Supernatural Investigation, exclusively on Wakanim!",60,https://www.wakanim.tv/sc/v2/catalogue/show/890/muhyo-rojis-bureau-of-supernatural-investigation,"https://d2y6mqrpjbqoe6.cloudfront.net/image/upload/f_auto,q_auto/cdn1/library/17_637292153041949034MR_Small.jpg",Action | Comedy | Supernatural,2
Mushoku Tensei: Jobless Reincarnation,2021,47,"Reincarnated in a magical world, Rudeus wants to become the greatest magician in history! A classic of the isekai genre adapted by studio Bind.",92,https://www.wakanim.tv/sc/v2/catalogue/show/1170/mushoku-tensei-jobless-reincarnation,"https://d2y6mqrpjbqoe6.cloudfront.net/image/upload/f_auto,q_auto/cdn1/library/21_637452035346470509Mushoku-Tensei_Small.jpg",Action | Adventure | Drama | Ecchi | Fantasy | Isekai | Magic,4
MUTEKING THE Dancing HERO,2021,12,Here’s the reboot of Tondemo Senshi Muteking! Our hero is an ordinary young boy...,48,https://www.wakanim.tv/sc/v2/catalogue/show/1535/muteking-the-dancing-hero,"https://d2y6mqrpjbqoe6.cloudfront.net/image/upload/f_auto,q_auto/cdn1/library/110_637686905287964492MKDH_Small.jpg",Action | Comedy | Romance | Sci-Fi,1
My Dress-Up Darling,2022,24,"High schooler Wakana Gojo cares about one thing: making Hina dolls. With nobody to share his obsession, he has trouble finding friends—or even holding conversation.",94,https://www.wakanim.tv/sc/v2/catalogue/show/1649/my-dress-up-darling,"https://d2y6mqrpjbqoe6.cloudfront.net/image/upload/f_auto,q_auto/cdn1/library/3112_637765617546728960MDUD_Small.jpg",Romance | Slice of Life,2
My First Girlfriend is a Gal,2017,22,Junichi is desperate to lose his virginity and seeks out Yukana for a good time. But his first mistake was thinking this gal was easy!,80,https://www.wakanim.tv/sc/v2/catalogue/show/972/my-first-girlfriend-is-a-gal,"https://d2y6mqrpjbqoe6.cloudfront.net/image/upload/f_auto,q_auto/cdn1/library/55_637242741031854961First-Girlfriend-Gal_Small.jpg",Comedy | Ecchi | Romance | Slice of Life,2
My Senpai is Annoying,2021,24,"Igarashi is a young office worker. While Takeda, her superior, is constantly annoying her, she ends up getting attached to him.",88,https://www.wakanim.tv/sc/v2/catalogue/show/1523/my-senpai-is-annoying,"https://d2y6mqrpjbqoe6.cloudfront.net/image/upload/f_auto,q_auto/cdn1/library/210_637687626980934706SA_Small.jpg",Comedy | Romance | Slice of Life,2
NekoparA,2020,24,"Head to the Patisserie La Soleil where catgirls like Chocola, Vanilla and more are ready to serve!",86,https://www.wakanim.tv/sc/v2/catalogue/show/658/nekopara,"https://d2y6mqrpjbqoe6.cloudfront.net/image/upload/f_auto,q_auto/cdn1/library/33_637188495491368677Nekopara_Small_Dub.jpg",Comedy | Romance | Slice of Life,2
Nichijou - My Ordinary Life,2011,52,"Follow the adventures of three ordinary girls as they learn their most important lessons the hard way. Meanwhile, a pocket-sized professor makes life difficult for a robot who just wants to be normal.",88,https://www.wakanim.tv/sc/v2/catalogue/show/727/nichijou-my-ordinary-life,"https://d2y6mqrpjbqoe6.cloudfront.net/image/upload/f_auto,q_auto/cdn1/library/285_637262678998109024Nichijou_Small.jpg",Comedy | Shounen | Slice of Life,4
Ninja Slayer From Animation,2015,52,"NINJA SLAYER is a ninja who kills other ninjas in the name of ninja vengeance. In a dystopian world, he stands alone.",8,https://www.wakanim.tv/sc/v2/catalogue/show/733/ninja-slayer-from-animation,"https://d2y6mqrpjbqoe6.cloudfront.net/image/upload/f_auto,q_auto/cdn1/library/36_637267726013521799Ninja-Slayer_Small.jpg",Action | Comedy | Drama | Martial Arts | Sci-Fi | Supernatural,4
NO GUNS LIFE,2019,48,"Juzo Inui is an ex-soldier discharged after a terrible war. What makes him special? He has a giant revolver for a head, making him an Extend: a man enhanced with mechanical extensions. With no memories of his past, he makes a living by investigating crimes deep within the city’s underworld.",88,https://www.wakanim.tv/sc/v2/catalogue/show/550/no-guns-life,"https://d2y6mqrpjbqoe6.cloudfront.net/image/upload/f_auto,q_auto/cdn1/library/14_637213591578363401NGL-C2_Small.jpg",Action | Sci-Fi | Seinen,4
Noein: To Your Other Self,2005,48,She's the keystone in an interdimensional battle for the survival of all existence in the multiverse… All she wanted was a normal summer.,76,https://www.wakanim.tv/sc/v2/catalogue/show/676/noein-to-your-other-self,"https://d2y6mqrpjbqoe6.cloudfront.net/image/upload/f_auto,q_auto/cdn1/library/115_637247809644547219Noein_Small.jpg",Action | Adventure | Drama | Original | Romance | Sci-Fi | Slice of Life,4
No-Rin,2014,24,Hata Kosaku is crushed when his favorite idol retires from show biz. But his bad mood won't last long—she just transferred into his class!,66,https://www.wakanim.tv/sc/v2/catalogue/show/707/no-rin,"https://d2y6mqrpjbqoe6.cloudfront.net/image/upload/f_auto,q_auto/cdn1/library/273_637209003008571467No-Rin_Small.jpg",Comedy | Ecchi | Romance | Slice of Life,2
number24,2020,12,"Yuzuki Natsusa entered university as a promising rugby player, but he had to stop playing after a mysterious accident. Ueoka Ibuki, an older player, had to leave the team too.",84,https://www.wakanim.tv/sc/v2/catalogue/show/654/number24,"https://d2y6mqrpjbqoe6.cloudfront.net/image/upload/f_auto,q_auto/cdn1/library/71_637140092226352223N24_Small.jpg",Slice of Life | Sport,1
Oh! Edo Rocket,2007,52,"For Seikichi, making things explode is a calling, and this little man with a big rocket has one goal: send his lady to the moon.",0,https://www.wakanim.tv/sc/v2/catalogue/show/1055/oh-edo-rocket,"https://d2y6mqrpjbqoe6.cloudfront.net/image/upload/f_auto,q_auto/cdn1/library/317_637318074942086721Oh-Edo-Rocket_Small.jpg",Comedy | Drama | Fantasy | Historical | Sci-Fi,4
Omamori Himari,2010,12,Yuuto Amakawa’s life becomes pawsitively arousing when beautiful demons start showing up! But with beauty comes danger. Yuuto will have to face deadly Ayakashi while also balancing even more deadly and sensual girls.,76,https://www.wakanim.tv/sc/v2/catalogue/show/742/omamori-himari,"https://d2y6mqrpjbqoe6.cloudfront.net/image/upload/f_auto,q_auto/cdn1/library/145_637566071711158180Omamori-Himari_Small.jpg",Action | Comedy | Drama | Ecchi | Magic | Romance | Supernatural,1
Otherside Picnic,2021,12,What if ghost stories/urban legends were real? Cross the door to the otherworld to find out!,82,https://www.wakanim.tv/sc/v2/catalogue/show/1195/otherside-picnic,"https://d2y6mqrpjbqoe6.cloudfront.net/image/upload/f_auto,q_auto/cdn1/library/21_637452087693830536OP_Small.jpg",Adventure | Fantasy | Sci-Fi,1
Our Last Crusade or the Rise of a New World,2020,24,"The series, based on a light novel, follows the cool, disgraced knight of the science kingdom who faces off against the ice princess sorceress of the rival magic kingdom.",88,https://www.wakanim.tv/sc/v2/catalogue/show/1059/our-last-crusade-or-the-rise-of-a-new-world,"https://d2y6mqrpjbqoe6.cloudfront.net/image/upload/f_auto,q_auto/cdn1/library/210_637372586872673982OurLastCrusade_small.jpg",Action | Fantasy | Romance,2
Overlord,2015,91,"After a veteran player refuses to log out of a popular MMORPG, the NPC's begin to develop minds of their own—and he decides to rule them.",88,https://www.wakanim.tv/sc/v2/catalogue/show/667/overlord,"https://d2y6mqrpjbqoe6.cloudfront.net/image/upload/f_auto,q_auto/cdn1/library/161_637147638402438475Overlord_Small.jpg",Action | Adventure | Ecchi | Fantasy | Isekai | Magic,7
Overlord II,2018,0,"After a veteran player refuses to log out of a popular MMORPG, the NPC's begin to develop minds of their own—and he decides to rule them.",88,https://www.wakanim.tv/sc/v2/catalogue/show/668/overlord-ii,"https://d2y6mqrpjbqoe6.cloudfront.net/image/upload/f_auto,q_auto/cdn1/library/161_637147663200777148Overlord%20II%20small.png",Action | Adventure | Ecchi | Fantasy | Isekai | Magic,0
Overlord III,2018,0,"After a veteran player refuses to log out of a popular MMORPG, the NPC's begin to develop minds of their own—and he decides to rule them.",88,https://www.wakanim.tv/sc/v2/catalogue/show/669/overlord-iii,"https://d2y6mqrpjbqoe6.cloudfront.net/image/upload/f_auto,q_auto/cdn1/library/161_637147683576879710Overlord%20III%20small.png",Action | Adventure | Ecchi | Fantasy | Isekai | Magic,0
Pandora in the Crimson Shell: Ghost Urn,2016,24,"Cyborg Nene Nanakorobi teams up with a famous inventor and her cybernetic assistant, Clarion, to take down a super-powered terrorist.",72,https://www.wakanim.tv/sc/v2/catalogue/show/772/pandora-in-the-crimson-shell-ghost-urn,"https://d2y6mqrpjbqoe6.cloudfront.net/image/upload/f_auto,q_auto/cdn1/library/115_637247810988253809Crimson-Shell_Small.jpg",Action | Adventure | Comedy | Ecchi | Sci-Fi,2
Paranoia Agent,2004,26,"From Satoshi Kon, the legendary director of Perfect Blue, Millennium Actress, and Paprika comes a dark and mysterious, thought-provoking psychological thriller. Citizens across Musashino City are being attacked and terrorized.",80,https://www.wakanim.tv/sc/v2/catalogue/show/675/paranoia-agent,"https://d2y6mqrpjbqoe6.cloudfront.net/image/upload/f_auto,q_auto/cdn1/library/275_637577013410321323Paranoia-Agent_Small.jpg",Drama | Horror | Police | Seinen | Supernatural | Thriller,2
Phantasy Star Online 2 : Episode Oracle,2019,25,"In the year AP 238, the space-exploration fleet ""Oracle"" continues its journey. Upon the discovery of a new planet, ARKS descends to investigate and exterminate any Falspawn.",60,https://www.wakanim.tv/sc/v2/catalogue/show/586/phantasy-star-online-2-episode-oracle,"https://d2y6mqrpjbqoe6.cloudfront.net/image/upload/f_auto,q_auto/cdn1/library/2310_637074409703510771PSO_Small.png",Action | Adventure | Sci-Fi,2
Planetarian: The Reverie of a Little Planet,2016,12,"Hoshino Yumemi has patiently waited for customers at an abandoned planetarium for thirty years. When one shows up, can he help her rebuild?",86,https://www.wakanim.tv/sc/v2/catalogue/show/785/planetarian-the-reverie-of-a-little-planet,"https://d2y6mqrpjbqoe6.cloudfront.net/image/upload/f_auto,q_auto/cdn1/library/24_637214316610835488Planetarian_Small.jpg",Drama | Sci-Fi,4
Platinum End,2021,48,"""I will give you the hope to live."" Kakehashi Mirai lost his parents in an accident and lived in misery with the relatives who took him in.",64,https://www.wakanim.tv/sc/v2/catalogue/show/1568/platinum-end,"https://d2y6mqrpjbqoe6.cloudfront.net/image/upload/f_auto,q_auto/cdn1/library/410_637689400175966455PE_Small.jpg",Drama | Supernatural,4
Plunderer,2020,48,"Alcia, a world that was born after the great war, or so-called ""War of Elimination"".
This world is governed by the law of the strongest, where the strong and the weak are determined by their Count.",74,https://www.wakanim.tv/sc/v2/catalogue/show/596/plunderer,"https://d2y6mqrpjbqoe6.cloudfront.net/image/upload/f_auto,q_auto/cdn1/library/14_637213299704191566PL-C2_Small.jpg",Action | Adventure | Comedy | Drama | Ecchi | Shounen | Supernatural,4
Police in a Pod,2022,13,"Kawai, a young policewoman, can't stand her job anymore. On her way to hand in her resignation letter, she meets the new police station chief. After spending some time with her new boss, who will become a real role model in her eyes, she chooses to remain on the force a little longer... A refreshing comedy adapted from Miko Yasu's manga by the Madhouse studio (Death Note, One-Punch Man)!",78,https://www.wakanim.tv/sc/v2/catalogue/show/1684/police-in-a-pod,"https://d2y6mqrpjbqoe6.cloudfront.net/image/upload/f_auto,q_auto/cdn1/library/2712_637762096128116683PIP_Small.jpg",Comedy | Police | Slice of Life,1
Pop Team Epic,2018,36,"They’re crude, rude, and a little...cute? Get ready for the bizarre comedy antics of the small and tall Popuko and Pipimi!",74,https://www.wakanim.tv/sc/v2/catalogue/show/1040/pop-team-epic,"https://d2y6mqrpjbqoe6.cloudfront.net/image/upload/f_auto,q_auto/cdn1/library/287_637315376672342087Pop-Team-Epic_Small.jpg",Comedy,3
Pretty Boy Detective Club,2021,24,Mayumi Dojima is a young girl who has been searching for a star that she saw only once ten years ago. She visits the headquarters of the Pretty Boy Detective Club where she meets five boys who are each unique in their own way.,78,https://www.wakanim.tv/sc/v2/catalogue/show/1297/pretty-boy-detective-club,"https://d2y6mqrpjbqoe6.cloudfront.net/image/upload/f_auto,q_auto/cdn1/library/24_637529551015174313PBD_Small.jpg",,2
Prince of Stride: Alternative,2016,24,"Nana and Takeru are desperate to resurrect the Stride Club—but will they be able to persuade Riku, who insists he hates Stride, to sign up?",70,https://www.wakanim.tv/sc/v2/catalogue/show/770/prince-of-stride-alternative,"https://d2y6mqrpjbqoe6.cloudfront.net/image/upload/f_auto,q_auto/cdn1/library/243_637206396097267306Stride-Alternative_Small.jpg",Comedy | Drama | Sport,2
Princess Jellyfish,2010,22,"Tsukimi and her friends are nerds who rarely leave their all-girl apartment, that is, until they meet a ""Stylish Girl"" with a big secret.",98,https://www.wakanim.tv/sc/v2/catalogue/show/1038/princess-jellyfish,"https://d2y6mqrpjbqoe6.cloudfront.net/image/upload/f_auto,q_auto/cdn1/library/306_637291294183700739Princess-Jellyfish_Small.jpg",Comedy | Romance | Slice of Life,2
Prison School,2015,24,The school is ruled by a secret council of sadistic female students. The boys are in for a world of hurt.,84,https://www.wakanim.tv/sc/v2/catalogue/show/666/prison-school,"https://d2y6mqrpjbqoe6.cloudfront.net/image/upload/f_auto,q_auto/cdn1/library/161_637147629860902119Prison-School_Small.jpg",Comedy | Ecchi,2
PUCHIM@S 2,2014,74,Fans of the iDOLM@STER franchise won’t want to miss this super cute spinoff! Hyperactive hijinks are sure to follow when the idol girls of 765 Productions discover the mysterious Puchidols—chibis with adorable abilities—have invaded their office!,0,https://www.wakanim.tv/sc/v2/catalogue/show/712/puchims-2,"https://d2y6mqrpjbqoe6.cloudfront.net/image/upload/f_auto,q_auto/cdn1/library/275_637577013803024481Puchimasu-S2_Small.jpg",Comedy | Slice of Life,6
PuraOre! ~Pride of Orange~,2021,12,Enjoy the first ever female ice hockey anime and follow a group of girls aiming for the top of the world through ice hockey!,74,https://www.wakanim.tv/sc/v2/catalogue/show/1503/puraore-pride-of-orange,"https://d2y6mqrpjbqoe6.cloudfront.net/image/upload/f_auto,q_auto/cdn1/library/110_637687006000435221PO_Small.jpg",Sport,1
Puzzle & Dragons X,2016,76,Winners reap rewards in the puzzle wars. But what if you lose? Only the brave can take on these monstrous challenges!,100,https://www.wakanim.tv/sc/v2/catalogue/show/801/puzzle-dragons-x,"https://d2y6mqrpjbqoe6.cloudfront.net/image/upload/f_auto,q_auto/cdn1/library/115_637247806695174487Puzzle-Dragons_Small.jpg",Adventure | Comedy,6
RADIANT,2018,21,Seth is more determined than ever before to find Radiant! And he’ll encounter new enemies and allies during his legendary quest.,84,https://www.wakanim.tv/sc/v2/catalogue/show/1043/radiant,"https://d2y6mqrpjbqoe6.cloudfront.net/image/upload/f_auto,q_auto/cdn1/library/297_637316150051799775Radiant_Small.jpg",Action | Adventure | Fantasy | Magic,2
