title,year,episodes,description,rating,link,image,genres,seasons
Rampo Kitan: Game of Laplace,2015,22,"When a murder at a middle school attracts the attention of genius detective Akechi, a student volunteers to help with his investigation.",40,https://www.wakanim.tv/sc/v2/catalogue/show/934/rampo-kitan-game-of-laplace,"https://d2y6mqrpjbqoe6.cloudfront.net/image/upload/f_auto,q_auto/cdn1/library/154_637225621187959686Rampo-Kitan_Small.jpg",Drama | Horror | Thriller,2
Ranking of Kings,2021,46,"How prosperous your nation is, how many powerful warriors it boasts, and how heroic and strong its king is. These are the criteria that factor into the system known as the Ranking of Kings.",88,https://www.wakanim.tv/sc/v2/catalogue/show/1492/ranking-of-kings,"https://d2y6mqrpjbqoe6.cloudfront.net/image/upload/f_auto,q_auto/cdn1/library/210_637687631119793475RK_Small.jpg",Adventure | Fantasy,4
Record of Lodoss War,1990,26,"In a land torn by war, young Parn and a ragtag team of adventurers set out to restore peace to the island of Lodoss.",54,https://www.wakanim.tv/sc/v2/catalogue/show/736/record-of-lodoss-war,"https://d2y6mqrpjbqoe6.cloudfront.net/image/upload/f_auto,q_auto/cdn1/library/74_637218692875302426imgpsh_fullsize_anim.jpg",Action | Adventure | Drama | Fantasy | Magic | Romance | Shounen | Supernatural,2
Record of Lodoss War: Chronicles of the Heroic Knight,1998,54,"In a land torn by war, young Parn and a ragtag team of adventurers set out to restore peace to the island of Lodoss.",66,https://www.wakanim.tv/sc/v2/catalogue/show/735/record-of-lodoss-war-chronicles-of-the-heroic-knight,"https://d2y6mqrpjbqoe6.cloudfront.net/image/upload/f_auto,q_auto/cdn1/library/313_637212378718947971Lodoss-War_Small.jpg",Action | Adventure | Drama | Fantasy | Magic | Romance,4
Regalia: The Three Sacred Stars,2016,26,"When a large mecha attacks the Enastria Empire, sisters Yui and Rena are pulled from their peaceful life and into a vortex of destiny!",72,https://www.wakanim.tv/sc/v2/catalogue/show/780/regalia-the-three-sacred-stars,"https://d2y6mqrpjbqoe6.cloudfront.net/image/upload/f_auto,q_auto/cdn1/library/313_637212380204902395Regalia_Small.jpg",Action | Mecha | Sci-Fi,2
RE-MAIN,2021,24,"The first water polo anime, adapted from the manga by Masafumi Nishida (Tiger & Bunny) by the excellent studio MAPPA (Attack of the Titans S4, Jujutsu Kaisen).",72,https://www.wakanim.tv/sc/v2/catalogue/show/1393/re-main,"https://d2y6mqrpjbqoe6.cloudfront.net/image/upload/f_auto,q_auto/cdn1/library/17_637607338888311430Re-Main_Small.jpg",Sport,2
Requiem of the Rose King,2022,49,"The manga artist Aya Kanno (Otomen) brings us a new interpretation of Richard III, the play by Shakespeare, in which the hero is a hermaphrodite! From birth, Richard, heir to the prestigious York family throne, was a child rejected by all. But everything changes when his father becomes embroiled in a battle for the throne. From this war emerges a bloodthirsty tyrant who will leave an indelible mark the history of England...",80,https://www.wakanim.tv/sc/v2/catalogue/show/1696/requiem-of-the-rose-king,"https://d2y6mqrpjbqoe6.cloudfront.net/image/upload/f_auto,q_auto/cdn1/library/2712_637762089700488948RRK_Small.jpg",Action | Drama | Supernatural,4
"RErideD – Derrida, who leaps through time –",2018,12,"When Derrida wakes up from a 10-year cold sleep, he’ll fight to survive a devastated world to keep a promise to his friend.",0,https://www.wakanim.tv/sc/v2/catalogue/show/1041/rerided-derrida-who-leaps-through-time,"https://d2y6mqrpjbqoe6.cloudfront.net/image/upload/f_auto,q_auto/cdn1/library/287_637315427029419304Redride-D_Small.jpg",Action | Drama | Sci-Fi,1
Restaurant to Another World,2017,12,"The regulars here are anything but normal! Every Saturday, a bell rings and this restaurant opens its doors to some unusual guests.",68,https://www.wakanim.tv/sc/v2/catalogue/show/1042/restaurant-to-another-world,"https://d2y6mqrpjbqoe6.cloudfront.net/image/upload/f_auto,q_auto/cdn1/library/287_637315437158092937Restaurant-Another-World_Small.jpg",Comedy | Fantasy,1
Riddle Story of Devil,2014,24,12 beautiful assassins. 1 innocent target. Tokaku Azuma was a sure bet to win—until she had a change of heart.,80,https://www.wakanim.tv/sc/v2/catalogue/show/709/riddle-story-of-devil,"https://d2y6mqrpjbqoe6.cloudfront.net/image/upload/f_auto,q_auto/cdn1/library/285_637262598516891223Riddle-Story_Small.jpg",Action | Drama | Romance | Thriller,2
RIN - Daughters of Mnemosyne,2008,12,"Rin, an immortal private detective, struggles to unravel the secrets of her endless agony at the hands of a memory-eating monster.",66,https://www.wakanim.tv/sc/v2/catalogue/show/695/rin-daughters-of-mnemosyne,"https://d2y6mqrpjbqoe6.cloudfront.net/image/upload/f_auto,q_auto/cdn1/library/36_637267727639419586Rin_Small.jpg",Action | Drama | Ecchi | Horror | Josei | Original | Sci-Fi | Supernatural | Thriller | Yuri,2
RobiHachi,2019,24,"G.C.0051.
500 years have passed since the first contact.
Humanity has acquired the technology enabling them to travel at the speed of light and has federated several planets and extra-terrestrial species.",66,https://www.wakanim.tv/sc/v2/catalogue/show/502/robihachi,"https://d2y6mqrpjbqoe6.cloudfront.net/image/upload/f_auto,q_auto/cdn1/library/64_636901578073735233RobiHachi_Small.png",Action | Original | Sci-Fi,2
RUMBLE GARANNDOLL,2021,24,"In 2019, an army from another world invades Japan. Ten years later, the country is a dictatorship, manga, anime and video games are forbidden. At least in appearance, because the otaku cultural resistance is on the march!",62,https://www.wakanim.tv/sc/v2/catalogue/show/1502/rumble-garanndoll,"https://d2y6mqrpjbqoe6.cloudfront.net/image/upload/f_auto,q_auto/cdn1/library/210_637687635724748742RG_Small.jpg",Action | Adventure | Mecha | Sci-Fi,2
SABIKUI BISCO,2022,24,Time for a Mad Max style shonen! A devastating rust wind has turned Japan into a desert where everyone struggles to survive.,86,https://www.wakanim.tv/sc/v2/catalogue/show/1634/sabikui-bisco,"https://d2y6mqrpjbqoe6.cloudfront.net/image/upload/f_auto,q_auto/cdn1/library/3112_637765621934210789SB_Small.jpg",Action | Adventure | Fantasy,2
SAIYUKI RELOAD BLAST,2017,12,"The boys of SAIYUKI are back! Finally arriving in India, the Sanzo party must prepare for their toughest battles yet.",100,https://www.wakanim.tv/sc/v2/catalogue/show/1044/saiyuki-reload-blast,"https://d2y6mqrpjbqoe6.cloudfront.net/image/upload/f_auto,q_auto/cdn1/library/297_637316156944199566Saiyuki-Reload-Blast_Small.jpg",Action | Adventure | Comedy | Drama | Josei | Supernatural,1
Sakura Wars the Animation,2020,24,"1941, the imperial capital of Tokyo is now peaceful again. When Kamiyama Seijuro, the leader of the Flower Division of the Imperial Combat Revue is transferred to Europe, Sakura Amamiya is promoted co-leader.",80,https://www.wakanim.tv/sc/v2/catalogue/show/872/sakura-wars-the-animation,"https://d2y6mqrpjbqoe6.cloudfront.net/image/upload/f_auto,q_auto/cdn1/library/14_637213554660920961NSW_Small.jpg",Action | Adventure | Sci-Fi,2
Sasaki and Miyano,2022,24,"Time for romance with this new boy's love from Studio DEEN (Junjou Romantica, Vampire Knight, Fate/stay night)!",90,https://www.wakanim.tv/sc/v2/catalogue/show/1678/sasaki-and-miyano,"https://d2y6mqrpjbqoe6.cloudfront.net/image/upload/f_auto,q_auto/cdn1/library/3112_637765599254980318SM_Small.jpg",Slice of Life | Yaoi,1
Scar on the Praeter,2021,26,"For these divine warriors, enforcing law has never been so turbulent! An original creation of GoHands and Frontier Works studios.",48,https://www.wakanim.tv/sc/v2/catalogue/show/1163/scar-on-the-praeter,"https://d2y6mqrpjbqoe6.cloudfront.net/image/upload/f_auto,q_auto/cdn1/library/31_637452818686817773Scar-OTP_Small.jpg",Action | Sci-Fi | Supernatural,2
Scared Rider Xechs,2016,12,Researcher Akira Asagi is elected leader of the Blue World in the fierce war against the Red World. She must take charge of combat unit “IS” comprised of six riders known as the Scared Rider Xechs. She will lead them in a war of reason versus instinct.,0,https://www.wakanim.tv/sc/v2/catalogue/show/783/scared-rider-xechs,"https://d2y6mqrpjbqoe6.cloudfront.net/image/upload/f_auto,q_auto/cdn1/library/115_637247801961875199Scar-red-Rider-Xechs_Small%20(1).jpg",Action | Adventure | Drama | Sci-Fi,1
Scarlet Nexus,2021,52,Psychokinetic Yuito enlists to fight Earth’s enemy. But his teammate Kasane’s strange dreams drag the two into an unavoidable fate.,84,https://www.wakanim.tv/sc/v2/catalogue/show/1349/scarlet-nexus,"https://d2y6mqrpjbqoe6.cloudfront.net/image/upload/f_auto,q_auto/cdn1/library/17_637607314036607523SN_Small.jpg",Action,4
Scrapped Princess,2003,48,"Pacifica Cassul is living on the run, for prophecy has named her the poison that would destroy the world. But with her adoptive siblings at her side, she uncovers the incredible truth behind the prophecy and its ties to events from 5,000 years ago.",80,https://www.wakanim.tv/sc/v2/catalogue/show/737/scrapped-princess,"https://d2y6mqrpjbqoe6.cloudfront.net/image/upload/f_auto,q_auto/cdn1/library/304_637238492172816130Scrapped-Princess_Small.jpg",Action | Adventure | Comedy | Drama | Fantasy | Mecha | Sci-Fi | Shounen,4
SD GUNDAM WORLD HEROES,2021,24,"When a meteor strikes Neo World, an astrologer finds an amnesiac Gundam and an impending chaos spreading across the universe. With the help of a sword-wielding friend, he’ll embark on a quest to bring intergalactic peace.",50,https://www.wakanim.tv/sc/v2/catalogue/show/1340/sd-gundam-world-heroes,"https://d2y6mqrpjbqoe6.cloudfront.net/image/upload/f_auto,q_auto/cdn1/library/14_637528966920941109GWH_Small.jpg",Action | Mecha,2
Seiyu's Life!,2015,13,Follow a rookie seiyu as she takes her first steps into the world of professional voice acting!,72,https://www.wakanim.tv/sc/v2/catalogue/show/1004/seiyus-life,"https://d2y6mqrpjbqoe6.cloudfront.net/image/upload/f_auto,q_auto/cdn1/library/96_637272897348876686SeiyusLife_Small.jpg",Comedy | Slice of Life,1
Selection Project,2021,13,"At a time when becoming an idol is becoming increasingly difficult, the easiest way to do so is to win the Selection Project reality show.",64,https://www.wakanim.tv/sc/v2/catalogue/show/1399/selection-project,"https://d2y6mqrpjbqoe6.cloudfront.net/image/upload/f_auto,q_auto/cdn1/library/110_637686734318866766SP_Small.jpg",Music | Original,1
Selector Infected Wixoss,2014,48,"In the popular game WIXOSS, there are special cards that possess wills of their own. Ruko just found one and now she's heading into battle.",98,https://www.wakanim.tv/sc/v2/catalogue/show/711/selector-infected-wixoss,"https://d2y6mqrpjbqoe6.cloudfront.net/image/upload/f_auto,q_auto/cdn1/library/313_637212382011247218Selector_Small.jpg",Drama | Magic | Thriller,4
SENRAN KAGURA S2,2018,12,"Studying ancient ninjutsu at their hidden academy, the beauties of SENRAN KAGURA will prove they’ve got the technique to take on any enemy!",0,https://www.wakanim.tv/sc/v2/catalogue/show/1045/senran-kagura-s2,"https://d2y6mqrpjbqoe6.cloudfront.net/image/upload/f_auto,q_auto/cdn1/library/297_637316249922407835Senran-Kagura_Small.jpg",Action | Comedy | Ecchi,1
Servamp,2016,24,"After Mahiru Shirota rescues what he thought was an ordinary cat, he’s pulled into the world of servamps. Life couldn’t be more complicated!",72,https://www.wakanim.tv/sc/v2/catalogue/show/777/servamp,"https://d2y6mqrpjbqoe6.cloudfront.net/image/upload/f_auto,q_auto/cdn1/library/313_637212383441864312Servamp_Small.jpg",Action | Comedy | Josei | Magic | Supernatural | Vampire,2
Seven Mortal Sins,2017,13,"When Lucifer is cast to Hell, the Seven Mortal Sins seal her powers to maintain their hold over the realm. But Lucifer has other plans.",90,https://www.wakanim.tv/sc/v2/catalogue/show/1046/seven-mortal-sins,"https://d2y6mqrpjbqoe6.cloudfront.net/image/upload/f_auto,q_auto/cdn1/library/297_637316269719967068Seven-Mortal-Sins_Small.jpg",Ecchi | Fantasy,1
"Shachibato! President, It's Time for Battle!",2020,24,"The world used to be in a never-ending state of destruction.
A goddess came down from the sky and a giant portal appeared in the air. The people living in Gatepia noticed the presence of a miraculous energy inside it.",78,https://www.wakanim.tv/sc/v2/catalogue/show/850/shachibato-president-its-time-for-battle,"https://d2y6mqrpjbqoe6.cloudfront.net/image/upload/f_auto,q_auto/cdn1/library/14_637213585842638807Shachibato_Small.jpg",Action | Adventure | Fantasy,2
SHADOWS HOUSE,2021,38,"High atop a cliff sits the mansion known as Shadows House, home to a faceless clan that pretends to live like nobles. They express their emotions through living dolls that also endlessly clean the home of soot.",88,https://www.wakanim.tv/sc/v2/catalogue/show/1311/shadows-house,"https://d2y6mqrpjbqoe6.cloudfront.net/image/upload/f_auto,q_auto/cdn1/library/24_637529540212104723SH_Small.jpg",Seinen | Slice of Life | Supernatural,3
She Professed Herself Pupil of the Wise Man,2021,24,"In his favorite MMO game, Sakimori Kagami plays as Dunbalf, an ultra-powerful wizard recognized by all other players.",74,https://www.wakanim.tv/sc/v2/catalogue/show/1352/she-professed-herself-pupil-of-the-wise-man,"https://d2y6mqrpjbqoe6.cloudfront.net/image/upload/f_auto,q_auto/cdn1/library/31_637768256012387301PWM_Small.jpg",Fantasy | Isekai,2
SHIMONETA: A Boring World Where the Concept of Dirty Jokes Doesn’t Exist,2015,24,Who is the panty-masked villainess spreading obscenity in a country where even the mildest off-color musing can land you in jail?,88,https://www.wakanim.tv/sc/v2/catalogue/show/1037/shimoneta-a-boring-world-where-the-concept-of-dirty-jokes-doesnt-exist,"https://d2y6mqrpjbqoe6.cloudfront.net/image/upload/f_auto,q_auto/cdn1/library/306_637291154343324191Shimoneta_Small.jpg",Action | Comedy | Ecchi,2
Shironeko Project: Zero Chronicle,2020,24,"Long, long ago, there once was the Kingdom of White in the sky and the Kingdom of Black on earth. The two maintained balance as they revolved around one another.",56,https://www.wakanim.tv/sc/v2/catalogue/show/840/shironeko-project-zero-chronicle,"https://d2y6mqrpjbqoe6.cloudfront.net/image/upload/f_auto,q_auto/cdn1/library/24_637214144707844559SPZC-2_Small.jpg",Action | Adventure | Drama | Fantasy | Romance,2
Shomin Sample,2015,24,"Kimito Kagurazaka is living an average life until he's forced to enroll in a secret academy for the richest, most elite young ladies.",82,https://www.wakanim.tv/sc/v2/catalogue/show/763/shomin-sample,"https://d2y6mqrpjbqoe6.cloudfront.net/image/upload/f_auto,q_auto/cdn1/library/313_637212384478299795Shomin-Sample_Small.jpg",Comedy | Ecchi | Romance,2
Shonen Hollywood: Holly Stage for 49,2016,26,"Five boys band together to form the next generation of Shonen Hollywood, a legendary idol group from their childhoods.",10,https://www.wakanim.tv/sc/v2/catalogue/show/782/shonen-hollywood-holly-stage-for-49,"https://d2y6mqrpjbqoe6.cloudfront.net/image/upload/f_auto,q_auto/cdn1/library/265_637261043340414167Shonen-Hollywood_Small.jpg",Drama | Music | Shoujo | Slice of Life,2
Shonen Maid,2016,26,"Chihiro lands in the care of his uncle, Madoka, and has one job. Clean up after the messy young man. The catch—the maid outfit is mandatory!",66,https://www.wakanim.tv/sc/v2/catalogue/show/1054/shonen-maid,"https://d2y6mqrpjbqoe6.cloudfront.net/image/upload/f_auto,q_auto/cdn1/library/317_637318038505298305Shonen-Maid_Small.jpg",Comedy | Shoujo | Slice of Life,2
SHOW BY ROCK!!,2020,108,"In Tokyo Midi City, music is everything and ""battle of the bands"" is more than just teen rivalry.",90,https://www.wakanim.tv/sc/v2/catalogue/show/689/show-by-rock,"https://d2y6mqrpjbqoe6.cloudfront.net/image/upload/f_auto,q_auto/cdn1/library/164_637226459586277190Show-by-Rock_Small.jpg",Comedy | Fantasy | Music,9
Show by Rock!! Stars!! (S4),2021,0,Show by Rock!! Stars!! (S4),90,https://www.wakanim.tv/sc/v2/catalogue/show/1245/show-by-rock-stars-s4,"https://d2y6mqrpjbqoe6.cloudfront.net/image/upload/f_auto,q_auto/cdn1/library/71_637456368363417571SBR-S_Small.jpg",Comedy | Music,0
SK8 the Infinity,2021,24,"High school students Reki and Langa are hooked on one thing—a dangerous, top secret, no-holds-barred downhill skateboarding race called “S.”",92,https://www.wakanim.tv/sc/v2/catalogue/show/1206/sk8-the-infinity,"https://d2y6mqrpjbqoe6.cloudfront.net/image/upload/f_auto,q_auto/cdn1/library/21_637452075610744326SK8_Small.jpg",Sport,2
Skate-Leading Stars,2021,24,"The story of high-schoolers betting it all on skate-leading, an original group figure skating sport…",60,https://www.wakanim.tv/sc/v2/catalogue/show/1167/skate-leading-stars,"https://d2y6mqrpjbqoe6.cloudfront.net/image/upload/f_auto,q_auto/cdn1/library/2312_637443265428448439SLS_Small.jpg",Action | Adventure | Comedy | Drama | Fantasy | Seinen,2
Sky Wizards Academy,2015,24,"Forced to retreat to floating cities due to an invasion of armored insects, humanity must depend on Sky Wizards to battle the menace.",76,https://www.wakanim.tv/sc/v2/catalogue/show/761/sky-wizards-academy,"https://d2y6mqrpjbqoe6.cloudfront.net/image/upload/f_auto,q_auto/cdn1/library/285_637262707265360303Sky-Wizards-Academy_Small.jpg",Action | Drama | Fantasy | Magic,2
Sleepy Princess in the Demon Castle,2020,24,"Syalis is a princess. A really cute one. When she gets kidnapped by the Demon King as a hostage, she's stuck in a castle full of demons, waiting to be rescued by her knight in shining armor.",88,https://www.wakanim.tv/sc/v2/catalogue/show/1141/sleepy-princess-in-the-demon-castle,"https://d2y6mqrpjbqoe6.cloudfront.net/image/upload/f_auto,q_auto/cdn1/library/113_637510785208837508Sleepy-Princess_Small.jpg",Comedy | Fantasy | Shounen | Slice of Life | Supernatural,2
Slow Loop,2022,12,"Hiyori and Koharu met by the sea. While nothing seemed to connect the two girls, they realize that they are going to become half-sisters. From this beautiful story of friendship and an initiation into fishing, dive into this feel good shojo!",76,https://www.wakanim.tv/sc/v2/catalogue/show/1688/slow-loop,"https://d2y6mqrpjbqoe6.cloudfront.net/image/upload/f_auto,q_auto/cdn1/library/2712_637762095062672894SL_Small.jpg",Slice of Life | Sport,1
Smile Down the Runway,2020,24,"Fujito Chiyuki is 5 feet 2 but she wants to become a model and hit the Parisian catwalks. As she doesn’t fit the usual standards of the profession, her relatives advise her to give up, but she decides to persevere.",88,https://www.wakanim.tv/sc/v2/catalogue/show/631/smile-down-the-runway,"https://d2y6mqrpjbqoe6.cloudfront.net/image/upload/f_auto,q_auto/cdn1/library/285_637262745415190024SDR_Small.jpg",Comedy | Slice of Life,2
Snow White with the Red Hair,2015,48,"In the kingdom of Tanbarun lives Shirayuki, a lovely girl with gorgeous red hair. The Prince wants her for a concubine. She has other plans.",96,https://www.wakanim.tv/sc/v2/catalogue/show/734/snow-white-with-the-red-hair,"https://d2y6mqrpjbqoe6.cloudfront.net/image/upload/f_auto,q_auto/cdn1/library/24_637214318206642356Snow-White_Small.jpg",Adventure | Drama | Fantasy | Historical | Romance | Shoujo,4
Sonny Boy,2021,24,It’s an ordinary summer vacation...except Nagara’s high school has drifted into another dimension and his classmates are developing powers.,90,https://www.wakanim.tv/sc/v2/catalogue/show/1373/sonny-boy,"https://d2y6mqrpjbqoe6.cloudfront.net/image/upload/f_auto,q_auto/cdn1/library/17_637607508473511719SB_Small.jpg",Sci-Fi,2
Sorcerous Stabber Orphen,2020,50,"The story takes place on an old continent where dragons used to live, but now they have been replaced by prosperous humans. Young Krylancelo Finlandi lives with his sister Azalie at the Tower of Fangs, an academy of witchcraft.",58,https://www.wakanim.tv/sc/v2/catalogue/show/607/sorcerous-stabber-orphen,"https://d2y6mqrpjbqoe6.cloudfront.net/image/upload/f_auto,q_auto/cdn1/library/71_637140090419680254Orphen_Small.jpg",Action | Adventure | Comedy | Drama | Fantasy,4
Sorcerous Stabber Orphen: Battle of Kimluck,2021,0,STARTING JANUARY 20th,58,https://www.wakanim.tv/sc/v2/catalogue/show/1191/sorcerous-stabber-orphen-battle-of-kimluck,"https://d2y6mqrpjbqoe6.cloudfront.net/image/upload/f_auto,q_auto/cdn1/library/21_637452079162394778SSO_Small.jpg",Action | Adventure | Drama | Fantasy | Magic | Martial Arts,0
Space Battleship Tiramisu,2018,66,"In preparation for his vital wartime missions, ace pilot Subaru Ichinose launches an all-out food-based assault on his own face.",76,https://www.wakanim.tv/sc/v2/catalogue/show/1005/space-battleship-tiramisu,"https://d2y6mqrpjbqoe6.cloudfront.net/image/upload/f_auto,q_auto/cdn1/library/26_637267094754480653Tiramisu_Small%20(1).jpg",Action | Adventure | Comedy | Sci-Fi,8
Special 7: Special Crime Investigation Unit,2019,13,"A long time ago dragons ruled a world of elves, dwarves, vampires, homunculi, and humans. In the present dragons have all but disappeared, so the ones left chose to live together, and their appearance came to resemble that of humans.",66,https://www.wakanim.tv/sc/v2/catalogue/show/549/special-7-special-crime-investigation-unit,"https://d2y6mqrpjbqoe6.cloudfront.net/image/upload/f_auto,q_auto/cdn1/library/210_637056029132596018S7_Small.jpg",Action | Original | Police,1
SSSS.DYNAZENON,2021,24,"When Yomogi Asanaka, a first-year student at Fujiyokidai High School, meets Gauma, he claims to be a “kaiju user.” But the appearance of a kaiju followed by the entry of the gigantic robot, Dynazenon, backs up his mysterious words.",88,https://www.wakanim.tv/sc/v2/catalogue/show/1265/ssssdynazenon,"https://d2y6mqrpjbqoe6.cloudfront.net/image/upload/f_auto,q_auto/cdn1/library/24_637529554291651329Dynazanon_Small.jpg",Action | Mecha | Sci-Fi,2
SSSS.Gridman,2018,24,"When a behemoth threatens his city, Yuta is pulled into the digital world and reappears in the real one as the colossal hero—Gridman!",72,https://www.wakanim.tv/sc/v2/catalogue/show/802/ssssgridman,"https://d2y6mqrpjbqoe6.cloudfront.net/image/upload/f_auto,q_auto/cdn1/library/304_637238489479402057Gridman_Small.jpg",Action | Mecha | Sci-Fi,2
Star Blazers 2199,2012,104,"The power-hungry Gamilas have taken over Earth, and only a distant planet has the key to save humans from extinction. Sent to retrieve it, the crew of the Space Battleship Yamato will stop at nothing to save their home.",80,https://www.wakanim.tv/sc/v2/catalogue/show/795/star-blazers-2199,"https://d2y6mqrpjbqoe6.cloudfront.net/image/upload/f_auto,q_auto/cdn1/library/84_637219350147218566star-blazers2199_small.jpg",Action | Adventure | Alternate history | Sci-Fi,8
STARMYU,2015,12,"Yuta Hoshitani, a first year at Ayanagi Academy, finds out about auditions for the musical department and applies with his new friend, Nayuki.",78,https://www.wakanim.tv/sc/v2/catalogue/show/768/starmyu,"https://d2y6mqrpjbqoe6.cloudfront.net/image/upload/f_auto,q_auto/cdn1/library/115_637247800907250377STARMYU_Small.png",Comedy | Music | Slice of Life,1
"Steins"";Gate 0",2018,50,"Fueled by their imaginations, Okabe and his friends form a secret laboratory to unlock the mysteries of time travel.",90,https://www.wakanim.tv/sc/v2/catalogue/show/672/steinsgate-0,"https://d2y6mqrpjbqoe6.cloudfront.net/image/upload/f_auto,q_auto/cdn1/library/161_637147881442737140SteinsGate0Small.png",Drama | Romance | Sci-Fi | Thriller,6
"Steins"";Gate: The Movie - Load Region of Déjà Vu",2013,2,"Fueled by their imaginations, Okabe and his friends form a secret laboratory to unlock the mysteries of time travel.",86,https://www.wakanim.tv/sc/v2/catalogue/show/674/steinsgate-the-movie-load-region-of-deja-vu,"https://d2y6mqrpjbqoe6.cloudfront.net/image/upload/f_auto,q_auto/cdn1/library/156_637278196824827989SteinsGate-The-Movie_Small.jpg",Drama | Sci-Fi | Thriller,2
Strain: Strategic Armored Infantry,2006,26,"Sara Werec yearns to become a mech pilot just like her brother. But after he launches a treacherous attack, her new mission is to learn why.",70,https://www.wakanim.tv/sc/v2/catalogue/show/809/strain-strategic-armored-infantry,"https://d2y6mqrpjbqoe6.cloudfront.net/image/upload/f_auto,q_auto/cdn1/library/67_637296294745077736Strain_Small.jpg",Action | Drama | Ecchi | Mecha | Sci-Fi,2
Strike Witches,2008,48,"It's 1944, and the world lives in fear of alien invaders. It's up to the girls of the 501st Joint Fighter Wing, better known as the Strike Witches, to save the planet.",66,https://www.wakanim.tv/sc/v2/catalogue/show/1006/strike-witches,"https://d2y6mqrpjbqoe6.cloudfront.net/image/upload/f_auto,q_auto/cdn1/library/36_637267944606228678Strike-Witches_Small.jpg",Action | Comedy | Ecchi,4
Strike Witches: Road to Berlin,2020,24,"Allies around the world have formed an allied force to counter the sudden appearance of the human enemy ""Neuroi"".However, only girls with special magical powerscould compete with them ...",88,https://www.wakanim.tv/sc/v2/catalogue/show/1130/strike-witches-road-to-berlin,"https://d2y6mqrpjbqoe6.cloudfront.net/image/upload/f_auto,q_auto/cdn1/library/110_637371688345570264SW-RTB_Small.jpg",Action | Ecchi | Magic | Sci-Fi,2
Strike Witches: The Movie,2012,2,"Strike Witches, the 501st Joint Fighter Wing girls, are back from battle and ready to relax as best they can!",76,https://www.wakanim.tv/sc/v2/catalogue/show/724/strike-witches-the-movie,"https://d2y6mqrpjbqoe6.cloudfront.net/image/upload/f_auto,q_auto/cdn1/library/87_637298162344721893Strike_Witches_Movie_Small.jpg",Action | Ecchi | Magic | Original | Sci-Fi,2
Super Cub,2021,12,"There’s freedom in loneliness, and Koguma finds hers on a motorcycle. A Honda Super Cub motorcycle, to be exact. With no parents, friends, or plans for the future, Koguma’s daily detours on her way to school become her sole source of excitement.",98,https://www.wakanim.tv/sc/v2/catalogue/show/1304/super-cub,"https://d2y6mqrpjbqoe6.cloudfront.net/image/upload/f_auto,q_auto/cdn1/library/293_637526047341252973SC_Small.jpg",Slice of Life,1
